{
  "name": "#FF5555 武器供应商终端",
  "type": "terminal",
  "drop": 0.05,
  "random": [
    10,
    20,
    40,
    80,
    160
  ],
  "grade5": [
    {
      "id": "minecraft:netherite_sword"
    },
    {
      "id": "minecraft:trident"
    },
    {
      "id": "minecraft:bow",
      "components": {
        "minecraft:enchantments": {
          "minecraft:power": 5
        }
      }
    }
  ],
  "grade4": [
    {
      "id": "minecraft:diamond_sword"
    },
    {
      "id": "minecraft:crossbow",
      "components": {
        "minecraft:enchantments": {
          "minecraft:multishot": 1
        }
      }
    }
  ],
  "grade3": [
    {
      "id": "minecraft:golden_sword"
    },
    {
      "id": "minecraft:shield"
    }
  ],
  "grade2": [
    {
      "id": "minecraft:iron_sword"
    },
    {
      "id": "minecraft:bow"
    },
    {
      "id": "minecraft:arrow",
      "count": 64
    }
  ],
  "grade1": [
    {
      "id": "minecraft:wooden_sword"
    },
    {
      "id": "minecraft:stone_axe"
    },
    {
      "id": "minecraft:leather_helmet"
    }
  ]
}