{
  "name": "#00E5FF 附魔书终端",
  "type": "terminal",
  "drop": 0.04,
  "random": [
    15,
    30,
    60,
    120,
    220
  ],
  "grade5": [
    {
      "id": "minecraft:enchanted_book",
      "components": {
        "minecraft:stored_enchantments": {
          "minecraft:mending": 1
        }
      }
    },
    {
      "id": "minecraft:enchanted_book",
      "components": {
        "minecraft:stored_enchantments": {
          "minecraft:sharpness": 5
        }
      }
    }
  ],
  "grade4": [
    {
      "id": "minecraft:enchanted_book",
      "components": {
        "minecraft:stored_enchantments": {
          "minecraft:protection": 4
        }
      }
    },
    {
      "id": "minecraft:enchanted_book",
      "components": {
        "minecraft:stored_enchantments": {
          "minecraft:efficiency": 5
        }
      }
    }
  ],
  "grade3": [
    {
      "id": "minecraft:enchanted_book",
      "components": {
        "minecraft:stored_enchantments": {
          "minecraft:fire_aspect": 2
        }
      }
    },
    {
      "id": "minecraft:enchanted_book",
      "components": {
        "minecraft:stored_enchantments": {
          "minecraft:looting": 3
        }
      }
    }
  ],
  "grade2": [
    {
      "id": "minecraft:enchanted_book",
      "components": {
        "minecraft:stored_enchantments": {
          "minecraft:unbreaking": 3
        }
      }
    },
    {
      "id": "minecraft:enchanted_book",
      "components": {
        "minecraft:stored_enchantments": {
          "minecraft:silk_touch": 1
        }
      }
    }
  ],
  "grade1": [
    {
      "id": "minecraft:enchanted_book",
      "components": {
        "minecraft:stored_enchantments": {
          "minecraft:fortune": 1
        }
      }
    },
    {
      "id": "minecraft:enchanted_book",
      "components": {
        "minecraft:stored_enchantments": {
          "minecraft:smite": 2
        }
      }
    }
  ],
  "entity": [
    "minecraft:witch"
  ]
}