{
  "name": "#FFAA00 生存补给终端",
  "type": "terminal",
  "drop": 0.03,
  "random": [
    25,
    50,
    100,
    200,
    400
  ],
  "grade5": [
    {
      "id": "minecraft:shulker_box",
      "count": 1
    },
    {
      "id": "minecraft:elytra"
    }
  ],
  "grade4": [
    {
      "id": "minecraft:nether_star"
    },
    {
      "id": "minecraft:diamond_block"
    },
    {
      "id": "minecraft:totem_of_undying"
    }
  ],
  "grade3": [
    {
      "id": "minecraft:golden_apple"
    },
    {
      "id": "minecraft:ender_pearl",
      "count": 16
    },
    {
      "id": "minecraft:emerald_block"
    }
  ],
  "grade2": [
    {
      "id": "minecraft:diamond",
      "count": 16
    },
    {
      "id": "minecraft:ender_chest"
    },
    {
      "id": "minecraft:experience_bottle",
      "count": 32
    }
  ],
  "grade1": [
    {
      "id": "minecraft:iron_ingot",
      "count": 32
    },
    {
      "id": "minecraft:cooked_beef",
      "count": 64
    },
    {
      "id": "minecraft:gold_ingot",
      "count": 16
    }
  ],
  "entity": [
    "minecraft:zombie",
    0.1,
    "minecraft:skeleton",
    0.08,
    "minecraft:creeper",
    0.05
  ]
}